Topic,Title,Description,URL
data science,ODSC East 2018 (Open Data Science Conference),"ODSC
The Open Data Science Conference has established itself as the leading conference in the field of applied data science. Each ODSC event offers a unique opportunity to learn directly from the core contributors, experts, academics and renowned instructors helping shape the field of data science and artificial intelligence
Presentations cover not only data science modeling but also the languages and tools needed to deploy these models in the real world such as TensorFlow, MXNet, scikit-learn, Kubernetes, and many more.
Our conferences are organized around focus areas to ensure our attendees are at the forefront of this fast emerging field and current with the latest data science languages, tools, and models. You‚Äôll find in our East 2018 video catalog some of our most popular focus areas including:
Deep Learning and Machine Learning
Over the last 5 years, we have seen incredible advances in the field of data scientist thanks to breakthroughs in neural networks, transfer learning, reinforcement learning, and generative adversarial networks (GANs) to name a few. With the advent of Google Voice, Alexa, and other voice assistants, presentations on enabling technologies like NLP, RNNs, and LSTM are popular. Some session to note:
Distributed TensorFlow using KubernetesDeep Learning Pipelines for Big ImagesMachine Learning and Natural Language Processing for Detecting Fake NewsLong-Term Time Series Forecasting with Recurrent Neural NetworksA Breakthrough for Natural LanguageTransfer Learning: Applications for natural language understandingChallenges and Opportunities in Applying Machine LearningEffective Transfer Learning for NLPDeveloping Machine Learning Solutions with Plugin Machine Intelligence for PDIDistributed Tensorflow: Scaling Your Model Training
Core Data Science and Data Visualization
As data science advances at a rapid pace, core skills are more important than ever. Our sessions range from beginner to advanced level for core topics. Additionally, data and models need to be actionable and data visualization remains a key skill in any data scientist's toolkit. Some session of note include:
Bayesian Statistics Made SimpleGradient Descent, DemystifiedComparing Models Using Resampling and Bayesian MethodsNext Generation Indexes For Big Data EngineeringProbabilistic Programming with PyMC3Racial Bias in Facial Recognition SoftwareVisualization throughout the Data Science Workflow:Datafy All The Things
Data Science, Management, And Business
Data science is permeating every industry as adoption gathers pace. The management and practice of data science will become increasingly strategically important to all industries including finance and healthcare. Hear from leading experts on important topics including:
Blockchain and AI: future data systems must be built differentlyMarketing in a Machine Learning WorldThe Adoption of AI in Business: Opportunities and Challenges:Winning with AI: What's working, what needs work?Building an effective AI practiceApplied Finance: The Third CultureMachine Learning Powers Better Decisioning in Financial ServicesAI and Data Science in InvestmentAI and Big data in Medicine: Trust, Transparency, and TransformationAlgorithmic Transparency and Health Care: Where do we go from here?What will you do with democratized health data?A Physician-Data Scientist Grand Vision: A Virtual Medical Oracle
Thought Leadership | Keynotes
Data science and artificial intelligence are helping shape the future of business and society. Thoughtful leadership is essential and ODSC East was honored to host a few of the field's leading lights including Cathy O‚ÄôNeil, author of Weapons of Math Destruction, Drew Conway, one of the most well-known data scientists in the world, Gary Marcus, an award-winning Professor, and Kirk Borne, data scientist and executive advisor at Booz-Allen Hamilton. Thought-provoking presentations include:
Catherine O'Neil | Weapons of Math Destruction: Separating Data Facts and OpinionDrew Conway | Building a Data Science CompanyKirk Borne | Current and Future Trends in AI, Machine Learning, and Data ScienceGary Marcus | The Social Disease Known as Hype in AI and How to Separate What AI can do and What People Wish it Would do
Please see our table of contents for a full list of videos",/videos/odsc-east-2018/9780135432792/
data science,"Programming Skills for Data Science: Start Writing Code to Wrangle, Analyze, and Visualize Data with R, First Edition","The Foundational Hands-On Skills You Need to Dive into Data Science

“Freeman and Ross have created the definitive resource for new and aspiring data scientists to learn foundational programming skills.”
–From the foreword by Jared Lander, series editor
Using data science techniques, you can transform raw data into actionable insights for domains ranging from urban planning to precision medicine. Programming Skills for Data Science brings together all the foundational skills you need to get started, even if you have no programming or data science experience.

Leading instructors Michael Freeman and Joel Ross guide you through installing and configuring the tools you need to solve professional-level data science problems, including the widely used R language and Git version-control system. They explain how to wrangle your data into a form where it can be easily used, analyzed, and visualized so others can see the patterns you've uncovered. Step by step, you'll master powerful R programming techniques and troubleshooting skills for probing data in new ways, and at larger scales.

Freeman and Ross teach through practical examples and exercises that can be combined into complete data science projects. Everything's focused on real-world application, so you can quickly start analyzing your own data and getting answers you can act upon. Learn to
Install your complete data science environment, including R and RStudioManage projects efficiently, from version tracking to documentationHost, manage, and collaborate on data science projects with GitHubMaster R language fundamentals: syntax, programming concepts, and data structuresLoad, format, explore, and restructure data for successful analysisInteract with databases and web APIsMaster key principles for visualizing data accurately and intuitivelyProduce engaging, interactive visualizations with ggplot and other R packagesTransform analyses into sharable documents and sites with R MarkdownCreate interactive web data science applications with ShinyCollaborate smoothly as part of a data science team
Register your book for convenient access to downloads, updates, and/or corrections as they become available. See inside book for details.",/library/view/programming-skills-for/9780135159071/
data science,Utilizing Data and Data Science to Optimize Tune In,"Presented by Diane Leung, Principal, Analytics Innovation at Altman Vilandrie & Company
Measuring and optimizing tune-in is critically important for the media and entertainment industries. This discussion focuses on best practices for utilizing data and machine learning to optimize tune-in on national linear inventory. In order to do this properly, advertisers need to unify their marketing ecosystem, design a holistic measurement approach, and break down barriers for closed-loop, incremental measurement. In this session you will learn how to: 1) Create a framework for utilizing data and machine learning to maximize tune-in and 2) Overcome analytical obstacles created from fragmented and incomplete data.",/videos/utilizing-data-and/00000TSOQB75GW8K/
data science,ODSC West 2018 (Open Data Science Conference),"Royalties for this video set help fund ODSC community initiatives such as grants to open source projects, our diversity program, student travel grants, and other initiatives.
The Open Data Science Conference has established itself as the leading conference in the field of applied data science. Each ODSC event offers a unique opportunity to learn directly from the core contributors, experts, academics and renowned instructors helping shape the field of data science and artificial intelligence Presentations cover not only data science modeling but also the languages and tools needed to deploy these models in the real world such as TensorFlow, MXNet, scikit-learn, Kubernetes, and many more. Our conferences are organized around focus areas to ensure our attendees are at the forefront of this fast emerging field and current with the latest data science languages, tools, and models. You’ll find in our East 2018 video catalog some of our most popular focus areas including:
Deep Learning and Machine Learning
Over the last 5 years, we have seen incredible advances in the field of data scientist thanks to breakthroughs in neural networks, transfer learning, reinforcement learning, and generative adversarial networks (GANs) to name a few. With the advent of Google Voice, Alexa, and other voice assistants, presentations on enabling technologies like NLP, RNNs, and LSTM are popular. Some session to note:
OS for AI: How Serverless Computing Enables the Next Gen of ML—Jon Peckpomegranate: Fast and Flexible Probabilistic Modeling in Python—Jacob SchreiberData Wrangling to Provide Solar Energy Access Across Africa—Brianna Schuyler, PhDThe past, present, and future of Automated Machine Learning—Randy Olson, PhDMinimizing and Preventing Bias in AI—Frances HaugenDeep Learning on Mobile—Anirudh KoulState of the Art Natural Language Understanding at Scale—David Talby, PhDLatest Developments in GANS—Seth WeidmanHow to Reason About Stateful Streaming Machine Learning Serving—Lessons from Production—Patrick BoueriAn Introduction to Active Learning—Jennifer Prendki, PhDHow to use Satellite Imagery to be a Machine Learning Mantis Shrimp—Sean Patrick Gorman, PhD
Core Data Science and Data Visualization
As data science advances at a rapid pace, core skills are more important than ever. Our sessions range from beginner to advanced level for core topics. Additionally, data and models need to be actionable and data visualization remains a key skill in any data scientist’s toolkit. Some session of note include:
Panel: Visual Search: The Next Frontier of Search—Clayton MellinaVisualizing Vectors: Basics Every Data Scientist Should Know—Jed CrosbyRevolutionizing Visual Commerce—Robinson PiramuthuScaling Interactive Data Science and AI with Ray—Richard LiawThe Platform and Process of Agile Data Science—Sarah Aerni, PhDThe AI Engineer: A Foot in Two Worlds—Guy Royse
Data Science, Management, And Business
Data science is permeating every industry as adoption gathers pace. The management and practice of data science will become increasingly strategically important to all industries including finance and healthcare. Hear from leading experts on important topics including:
Managing Effective Data Science Teams—Conor JensenA Manager’s Guide to Starting a Computer Vision Program—Ali Vanderveld, PhDWord Play: Understanding the Mechanics and Business Value of Speech Technologies—Omar TawakolJust How Much Data Is Required to Make Autonomous Vehicles Truly Road-Ready?—Alexandr WangHow to Democratize Artificial Intelligence in Your Business—Olivier BlaisReality Check: Beyond the Hype. Real Companies Doing Real Business Getting Real Value with AI—Alyssa RochwergerAn Ethical Foundation for the AI-driven Future—Harry GlasserBest Practices for Deploying Machine Learning in the Enterprise—Robbie AllenGreatest hurdles in AI proliferation in Education—Varun Arora10 Things I Learned Deploying AI into Human Environments—Cameron Turner
Thought Leadership &verbar; Keynotes
Data science is permeating every industry as adoption gathers pace. The management and practice of data science will become increasingly strategically important to all industries including finance and healthcare. Hear from leading experts on important topics including:
Data Science and Open-Source Education for the Enterprise—Zachary Sean BrownTurning Machine Learning Research into Products for Industry—Reza Bosagh ZadehAI—Disruption for the Marketing World—Luc Dumont
Please see our table of contents for a full list of videos.",/videos/odsc-west-2018/9780136526476/
data science,Improving the Worlds Largest Online Grocery Catalog: A Data Science Story,"Presented by Ishant Nayer, Sr Data Scientist at Instacart
Being a data-driven company, Instacart realizes the power of good quality data. While trying to maximize the efficiency of data consumption by all work streams such as recommendation systems and availability systems, we are trying to make our Catalog the best in the world by delivering precise information to all our end-users including shoppers and consumers.
This session will cover the following areas:1. How we used data science to auto-detect inconsistencies in the data attributes of millions of items comprising the Catalog, in real-time.2. How we defined and utilized North Star metrics to optimize data quality of our Catalog3. Different approaches being used to deliver a great customer experience.",/videos/improving-the-worlds/00000I9SFX47SIE/
