Topic,Title,Description,URL
python,Python Fundamentals,"51+ hours of video instruction.
Overview
The professional programmer’s Deitel® video guide to Python development with the powerful IPython and Jupyter Notebooks platforms.
Description
Python Fundamentals LiveLessons with Paul Deitel is a code-oriented presentation of Python—one of the world’s most popular and fastest growing languages. In the context of scores of real-world code examples ranging from individual snippets to complete scripts, Paul will demonstrate coding with the interactive IPython interpreter and Jupyter Notebooks. You’ll quickly become familiar with the Python language, its popular programming idioms, key Python Standard Library modules and several popular open-source libraries. In the Intro to Data Science videos, Paul lays the groundwork for later lessons in which he’ll introduce some of today’s most compelling, leading-edge computing technologies, including natural language processing, data mining Twitter® for sentiment analysis, cognitive computing with IBM® Watson™, supervised machine learning with classification and regression, unsupervised machine learning with clustering, computer vision through deep learning and convolutional neural networks, sentiment analysis through deep learning with recurrent neural networks, big data with Hadoop®, Spark™ streaming, NoSQL databases and the Internet of Things.
Download the code examples for this LiveLesson from https://github.com/pdeitel/PythonFundamentalsLiveLessons. This repository will be updated with the additional lessons’ examples as the lessons are completed.
About the Instructor
Paul J. Deitel, CEO and Chief Technical Officer of Deitel & Associates, Inc., is a graduate of MIT, where he studied Information Technology. He holds the Sun (now Oracle) Certified Java Programmer and Certified Java Developer certifications, and is an Oracle Java Champion. Through Deitel & Associates, Inc., he has delivered Java, C#, Visual Basic, C++, C and Internet programming courses to industry clients, including Cisco, IBM, Sun Micro systems, Dell, Siemens, Lucent Technologies, Fidelity, NASA at the Kennedy Space Center, the National Severe Storm Laboratory, White Sands Missile Range, Rogue Wave Software, Boeing, SunGard Higher Education, Stratus, Cambridge Technology Partners, One Wave, Hyperion Software, Adra Systems, Entergy, CableData Systems, Nortel Networks, Puma, iRobot, Invensys and many more. He and his co-author, Dr. Harvey M. Deitel, are the world’s best-selling programming-language textbook/professional book authors.
Skill Level
Beginner-to-Intermediate
What you Will Learn in Part I
Before You Begin—Configure your system for Python, obtain the code examples, Python package managers, Paul’s contact info Lesson 1—Test-Drives: Using IPython and Jupyter Notebooks—Work with snippets and scripts in the context of IPython and Jupyter NotebooksLesson 2—Intro to Python Programming—Variables, types, operators, strings, I/O, decisions, objects and dynamic typingLesson 3—Control Statements—if, if…else, if…elif…else, for, while, break, continue, augmented assignments, boolean operators, intro to listsLesson 4—Functions—Custom function definitions, importing libraries, simulation with random-number generation, scope, default parameter values, keyword arguments, arbitrary argument lists, methods, intro to tuples, intro to functional-style programming
What you will learn in Part II:
Lesson 5—Sequences: Lists and Tuples—Create, initialize and access the elements of lists and tuples; sort and search lists, and search tuples; pass lists and tuples to functions and methods; list methods; functional-style programming (lambdas, filter, map, reduce, list comprehensions, generator expressions, 2D lists); static visualization with the Seaborn and Matplotlib visualization libraries.Lesson 6—Dictionaries and Sets—Dictionaries of key—value pairs; sets of unique values; iterating through keys, values and key—value pairs; adding, removing and updating key—value pairs; dictionary and set comparison operators; set operators and methods; operators in and not in for membership testing; mutable set operations; dictionary and set comprehensions; dynamic visualization with the Seaborn and Matplotlib visualization libraries.Lesson 7—Array-Oriented Programming with NumPy—numpy module’s high-performance ndarrays; how ndarrays differ from lists; comparing list vs. ndarrayperformance with the IPython %timeit magic; one-dimensional and multidimensionalndarrays; common ndarray manipulations; introduction to the pandas data manipulation library; one-dimensional Series and two-dimensional DataFrames; custom Series and DataFrame indices; basic descriptive statistics for data in aSeries and a DataFrame; customizing pandas output formatting.
What you will learn in Part III:
Lesson 8—Strings: A Deeper Look—String methods; string formatting; concatenating and repeating strings; stripping whitespace; string comparisons; search strings for substrings and replacing substrings; tokenizing strings; regular expressions for pattern matching, replacing substrings and validating data; manipulating data in pandas.Lesson 9—Files and Exceptions—Text-file processing; serializing objects into the JSON with the json module; with statement for avoiding “resource leaks”; exception handling; try…except statement; else clause; executing code when no exceptions occur in a try suite; finally clause; raise exceptions; more details on tracebacks; stack unwinding; CSV file processing via the csv module; loading and manipulating CSV files in pandas.Lesson 10—Object-Oriented Programming—Custom classes; controlling access to attributes; properties for data access; simulating “private” attributes; Python special methods for customizing string representations; inheritance, duck typing and polymorphism; class object; Python special methods for overloading operators; named tuples; Python 3.7 data classes; unit testing with doctest; namespaces and how they affect scope; Introduction to time series and simple linear regression.
What you will learn in Part IV:
Lesson 11—Natural Language Processing (NLP)—Install and use the TextBlob, NLTK, Textatistic and spaCy NLP libraries;, tokenize text into words and sentences; parts-of-speech tagging (noun, verb, etc.); sentiment analysis (positive, negative or neutral); detect the language of text; translate between languages; get word roots via stemming and lemmatization; spell checking and correction; word definitions, synonyms and antonyms; remove stop words from text; create word-cloud visualizations; determine text readability.Lesson 12—Data Mining Twitter®—Access tweets and other information on Twitter with Tweepy—a popular Python Twitter API client; search past tweets with the Twitter Search API; sample the live tweet stream with the Twitter Streaming API; work with tweet object meta data; use NLP techniques to clean and preprocess tweets for analysis; perform sentiment analysis on tweets; spot trending topics with Twitter’s Trends API; map tweets using folium and OpenStreetMap.Lesson 13—IBM Watson® and Cognitive Computing—Intro to Watson and its free Lite tier services; demos of several Watson services; registering for an IBM Cloud account; set up and get credentials for Watson services; install the Watson Developer Cloud Python SDK; build a Traveler’s companion language translator app that mashes up the Watson Speech to Text, Language Translator and Text to Speech services.
What you will learn in Part V’s case studies:
Lesson 14—Machine Learning: Classification, Regression and Clustering—Use scikit-learn with popular datasets to perform machine learning studies; Use Seaborn and Matplotlib to visualize and explore data; Perform supervised machine learning with k-nearest neighbors classification and linear regression; Perform multi-classification with Digits dataset; Divide a dataset into training, testing and validation sets; Tune hyperparameters with k-fold cross-validation; Measure model performance; Display a confusion matrix showing classification prediction hits and misses; Perform multiple linear regression with the California Housing dataset; Perform dimensionality reduction with PCA and t-SNE on the Iris and Digits datasets to prepare them for two-dimensional visualizations. Perform unsupervised machine learning with k-means clustering and the Iris dataset.Lesson 15—Deep Learning—What a neural network is and how it enables deep learning; Create Keras neural networks;Keras layers, activation functions, loss functions and optimizers; Use a Keras convolutional neural network (CNN) trained on the MNIST dataset to build a computer vision application that recognizes handwritten digits; Use a Keras recurrent neural network (RNN) trained on the IMDb dataset to create a sentiment analysis application that performs binary classification of positive and negative movie reviews.Lesson 16—Big Data: Hadoop, Spark, 17—Manipulate a SQLite relational database using SQL; Understand the four major types of NoSQL databases; Store tweets in a MongoDB NoSQL JSON document database and visualize them on a Folium map; Apache Hadoop and how it’s used in big-data batch-processing applications; Build a Hadoop MapReduce application on Microsoft’s Azure HDInsight cloud service; Apache Spark and how it’s used in high-performance, real-time big-data applications; Process mini-batches of data with Spark streaming; Internet of Things (IoT) and the publish/subscribe model; Publish messages from a simulated Internet-connected device and visualize messages in a dashboard; Subscribe to PubNub’s sample live streams and visualize the data.
LiveLessons Video Training series publishes hundreds of hands-on, expert-led video tutorials covering a wide selection of technology topics designed to teach you the skills you need to succeed. This professional and personal technology video series features world-leading author instructors published by your trusted technology brands: Addison-Wesley, Cisco Press, IBM Press, Pearson IT Certification, Prentice Hall, Sams, and Que. Topics include: IT Certification, Programming, Web Development, Mobile Development, Home & Office Technologies, Business & Management, and more. View All LiveLessons on InformIT: http://www.informit.com/imprint/series_detail.aspx?ser=2185116",/videos/python-fundamentals/9780135917411/
python,"Python Crash Course, 2nd Edition","This is the second edition of the best selling Python book in the world. Python Crash Course, 2nd Edition is a straightforward introduction to the core of Python programming. Author Eric Matthes dispenses with the sort of tedious, unnecessary information that can get in the way of learning how to program, choosing instead to provide a foundation in general programming concepts, Python fundamentals, and problem solving. Three real-world projects in the second part of the book allow readers to apply their knowledge in useful ways.
Readers will learn how to create a simple video game, use data visualization techniques to make graphs and charts, and build and deploy an interactive web application. Python Crash Course, 2nd Edition teaches beginners the essentials of Python quickly so that they can build practical programs and develop powerful programming techniques.
Uses Python 3",/library/view/python-crash-course/9781492071266/
python,"Fluent Python, 2nd Edition","Python’s simplicity lets you become productive quickly, but often this means you aren’t using everything it has to offer. With the updated edition of this hands-on guide, you’ll learn how to write effective, modern Python 3 code by leveraging its best ideas.
Don’t waste time bending Python to fit patterns you learned in other languages. Discover and apply idiomatic Python 3 features beyond your past experience. Author Luciano Ramalho guides you through Python’s core language features and libraries and teaches you how to make your code shorter, faster, and more readable.
Featuring major updates throughout the book, Fluent Python, second edition, covers:
Special methods: The key to the consistent behavior of Python objectsData structures: Sequences, dicts, sets, Unicode, and data classesFunctions as objects: First-class functions, related design patterns, and type hints in function declarationsObject-oriented idioms: Composition, inheritance, mixins, interfaces, operator overloading, static typing and protocolsControl flow: Context managers, generators, coroutines, async/await, and thread/process poolsMetaprogramming: Properties, attribute descriptors, class decorators, and new class metaprogramming hooks that are simpler than metaclasses",/library/view/fluent-python-2nd/9781492056348/
python,"Python for Data Analysis, 2nd Edition","Get complete instructions for manipulating, processing, cleaning, and crunching datasets in Python. Updated for Python 3.6, the second edition of this hands-on guide is packed with practical case studies that show you how to solve a broad set of data analysis problems effectively. You’ll learn the latest versions of pandas, NumPy, IPython, and Jupyter in the process.
Written by Wes McKinney, the creator of the Python pandas project, this book is a practical, modern introduction to data science tools in Python. It’s ideal for analysts new to Python and for Python programmers new to data science and scientific computing. Data files and related material are available on GitHub.
Use the IPython shell and Jupyter notebook for exploratory computingLearn basic and advanced features in NumPy (Numerical Python)Get started with data analysis tools in the pandas libraryUse flexible tools to load, clean, transform, merge, and reshape dataCreate informative visualizations with matplotlibApply the pandas groupby facility to slice, dice, and summarize datasetsAnalyze and manipulate regular and irregular time series dataLearn how to solve real-world data analysis problems with thorough, detailed examples",/library/view/python-for-data/9781491957653/
python,"Introducing Python, 2nd Edition","Easy to understand and fun to read, this updated edition of Introducing Python is ideal for beginning programmers as well as those new to the language. Author Bill Lubanovic takes you from the basics to more involved and varied topics, mixing tutorials with cookbook-style code recipes to explain concepts in Python 3. End-of-chapter exercises help you practice what you’ve learned.
You’ll gain a strong foundation in the language, including best practices for testing, debugging, code reuse, and other development tips. This book also shows you how to use Python for applications in business, science, and the arts, using various Python tools and open source packages.",/library/view/introducing-python-2nd/9781492051374/
python,Leveraging the disruptive power of artificial intelligence for fairer opportunities,"According to President Obama’s Council of Economic Advisers (CEA), approximately 3.1 million jobs will be rendered obsolete or permanently altered as a consequence of artificial intelligence technologies. Artificial intelligence (AI) will, for the foreseeable future, have a significant disruptive impact on jobs. That said, this disruption can create new opportunities if policymakers choose to harness them—including some with the potential to help address long-standing social inequities. Investing in quality training programs that deliver premium skills, such as computational analysis and cognitive thinking, provides a real opportunity to leverage AI’s disruptive power.Makada Henry-NickieFellow - Governance Studies  TwittermhnickieAI’s disruption presents a clear challenge: competition to traditional skilled workers arising from the cross-relevance of data scientists and code engineers, who can adapt quickly to new contexts. Data analytics has become an indispensable feature of successful companies across all industries. This reality dictates that companies invest heavily in data analytics to remain competitive and profitable. Consequently, unlikely industries such as retail, banking, finance, and even agricultural firms are aggressively competing for talent with specific computational data science and programming skills. A recent IBM report expertly quantifies the scope and breadth of employers’ hiring demands, noting that “[d]emand for data-driven decision makers, such as data-enabled marketing managers, will comprise one-third of the data savvy professional job market, with a projected increase of 110,000 positions by 2020.” Herein lies a window of opportunity: the rapidly growing technical skills gap.Investing in high-quality education and training programs is one way that policymakers proactively attempt to address the workforce challenges presented by artificial intelligence. It is essential that we make affirmative, inclusive choices to ensure that marginalized communities participate equitably in these opportunities.Policymakers should prioritize understanding the demographics of those most likely to lose jobs in the short-run. As opposed to obsessively assembling case studies, we need to proactively identify policy entrepreneurs who can conceive of training policies that equip workers with technical skills of “long-game” relevance. As IBM points out, “[d]ata democratization impacts every career path, so academia must strive to make data literacy an option, if not a requirement, for every student in any field of study.”Machines are an equal opportunity displacer, blind to color and socioeconomic status.Machines are an equal opportunity displacer, blind to color and socioeconomic status. Effective policy responses require collaborative data collection and coordination among key stakeholders—policymakers, employers, and educational institutions—to  identify at-risk worker groups and to inform workforce development strategies. Machine substitution is purely an efficiency game in which workers overwhelmingly lose. Nevertheless, we can blunt these effects by identifying critical leverage points.Investing in innovative education and training is an excellent place to start. Bill Gates’ recent $1.7 billion investment in U.S. public schools is a sign of the way forward, which offers two compelling messages for policymakers. First, innovate and experiment until we identify the right policies. Second, prioritize high-needs schools in poor neighborhoods; they deserve distinct attention to close their opportunity gaps and prepare them to be competitive in the future workforce.Policymakers can choose to harness AI’s disruptive power to address workforce challenges and redesign fair access to opportunity simultaneously. We should train our collective energies on identifying practical policies that update our current agrarian-based education model, which unfairly disadvantages children from economically segregated neighborhoods. Evidence from a Harvard and New York University research study suggests attending a high-quality high school increases a student’s chances of attending a four-year college; which by extension improves their future income earning potential.Let me ask a bold question: how much do we lose if we experiment with substituting an entry-level data science class for machine shop or a vocational carpentry program in urban high schools and community colleges? A 2010 pilot partnership between the University of California, Los Angeles and the National Science Foundation is an encouraging sign; the pilot focuses on redesigning computer science curricula in urban high schools to include newer mobile technologies and computational analysis.Related Technology & InnovationHow artificial intelligence is transforming the worldDarrell M. West and John R. AllenTuesday, April 24, 2018 Technology & InnovationTrends in the Information Technology sectorMakada Henry-Nickie, Kwadwo Frimpong, and Hao SunFriday, March 29, 2019 Technology & InnovationAlgorithmic bias detection and mitigation: Best practices and policies to reduce consumer harmsNicol Turner Lee, Paul Resnick, and Genie BartonWednesday, May 22, 2019Data science is an applied computational technology best suited to inquisitive minds, making it appropriate for young students. Google’s TensorFlow is an open source machine-learning platform; its free price tag makes the platform an accessible and scalable training resource for schools with constrained budgets. Introducing a data science program into urban schools would be a major paradigm shift for these students. An applied data science program teaching gateway coding skills such as Python, R, SQL, and computational analysis would boost employment possibilities and create meaningful pathways to economic mobility.I am suggesting that we leverage AI’s transformative power to disrupt diminishing possibilities for marginalized groups, like young men of color, who often do not feature in innovative-themed discussions outside of the social justice arena. Open Source groups such as Code.org and StudentRND exemplify the kinds of transformational approaches that democratize access and opportunity.Producing a diverse pipeline of tech-savvy workers for Google and Amazon, even if only at the entry level, is a more attainable dream for most cities than competing in a stacked race for Amazon’s HQ2. Broadening adoption of artificial intelligence technologies poses significant workforce challenges, but it also offers the chance to blunt these effects and create opportunities for marginalized groups if we act preemptively.Google is a donor to the Brookings Institution. The findings, interpretations, and conclusions posted in this piece are solely those of the authors and not influenced by any donation.",https://www.brookings.edu/blog/techtank/2017/11/16/leveraging-the-disruptive-power-of-artificial-intelligence-for-fairer-opportunities/
python,The Hutchins Center Explains: Budgeting for aging America,"For decades, we have been hearing that the baby-boom generation was like a pig moving through a python–bigger than the generations before and after. That’s true. But that’s also a very misleading metaphor for understanding the demographic forces that are driving up federal spending: They aren’t temporary. The generation born between 1946 and 1964 is the beginning of a demographic transition that will persist for decades after the baby boomers die, the consequence of lengthening lifespans and declining fertility. Putting the federal budget on a sustainable course requires long-lasting fixes, not short-lived tweaks.  First, a few demographic facts.As the chart below illustrates, there was a surge in births in the U.S. at the end of World War II, a subsequent decline, and then an uptick as baby boomers began having children.Although the population has been rising, the number of births in the U.S. the past few years has been below the peak baby-boom levels, possibly because many couples chose not to have children during bad economic times. More significant, fertility rates–roughly the number of babies born per woman during her lifetime–have fallen well below pre-baby-boom levels.Meanwhile, Americans are living longer. In 1950, a man who made it to age 65 could expect to live until 78 and a woman until 81. Social Security’s actuaries project that a man who lived to age 65 in 2010 will reach 84 and a woman age 86.Put all this together, and it’s clear that a growing fraction of the U.S. population will be 65 or older.   The combination of longer life spans and lower fertility rates means the ratio of elderly (over 65) to working-age population (ages 20 to 64) is rising. As the chart below illustrates, the ratio will rise steadily as more baby boomers reach retirement age–and then it levels off.  Related Books Autonomous VehiclesBy Clifford Winston and Quentin Karpilow 2020 Making College WorkBy Harry J. Holzer and Sandy Baum 2017 Dream HoardersBy Richard V. Reeves 2017Simply put, this doesn’t look like a pig in a python.  So what do these demographic facts portend for the federal budget?  In simple dollars and cents, the federal government spends more on the old than the young. More older Americans means more federal spending on Social Security and Medicare, the health insurance program for the elderly. On top of that, health care spending per person is likely to continue to grow faster than the overall economy.The net result: 85 percent of the increase in federal spending that the Congressional Budget Office projects for the next 10 years, based on current policies, will go toward Social Security, Medicare and other major federal health programs, and interest on the national debt. David WesselDirector - The Hutchins Center on Fiscal and Monetary Policy Senior Fellow - Economic Studies  TwitterdavidmwesselLouise SheinerThe Robert S. Kerr Senior Fellow - Economic Studies Policy Director - The Hutchins Center on Fiscal and Monetary Policy Restraining future deficits and the size of the federal debt mean restraining spending on these programs or raising taxes–and probably both. One-time savings or minor tweaks won’t suffice. Nor will limiting the belt-tightening to annually appropriated spending.The fundamental fiscal problem is not coping with the retirement of the baby boomers and then going back to budgets that resemble those of the past. The fundamental fiscal problem is that retirement of the baby boomers marks a major demographic transition for the nation, one that will require long-lived changes to benefit programs and taxes.Editor’s Note: This post originally appeared on The Wall Street Journal’s Washington Wire on December 18, 2015.",https://www.brookings.edu/blog/up-front/2015/12/21/the-hutchins-center-explains-budgeting-for-aging-america/
